{
  "$schema": "https://h5p-json-schemas.vercel.app/library.schema.json",
  "title": "Content Type Vite",
  "machineName": "H5P.ContentTypeVite",
  "majorVersion": 1,
  "minorVersion": 0,
  "patchVersion": 0,
  "runnable": 1,
  "license": "MIT",
  "author": "",
  "embedTypes": ["iframe"],
  "preloadedDependencies": [
    {
      "machineName": "H5P.JoubelUI",
      "majorVersion": 1,
      "minorVersion": 3
    }
  ],
  "preloadedJs": [
    {
      "path": "dist/h5p-content-type-vite.js"
    }
  ]
}
