{
  "title": "Word Typing Game Editor",
  "machineName": "H5P.WordTypingGameEditor",
  "majorVersion": 1,
  "minorVersion": 0,
  "patchVersion": 0,
  "runnable": 1,
  "license": "MIT",
  "author": "Sindre Bøyum",
  "embedTypes": ["iframe"],
  "preloadedJs": [
    {
      "path": "dist/h5p-word-typing-game-editor.js"
    }
  ]
}
