{
  "title": "Word Typing Game",
  "machineName": "H5P.WordTypingGame",
  "majorVersion": 1,
  "minorVersion": 0,
  "patchVersion": 0,
  "runnable": 1,
  "license": "MIT",
  "author": "Sindre Bøyum",
  "embedTypes": ["iframe"],
  "editorDependencies": [
    {
      "machineName": "H5P.WordTypingGameEditor",
      "majorVersion": 1,
      "minorVersion": 0
    }
  ],
  "preloadedJs": [
    {
      "path": "dist/h5p-word-typing-game.js"
    }
  ]
}